serialnum,articlenum,title,pubdate,text,probable,ukrainewar,Unnamed: 7,Unnamed: 8,Unnamed: 9,Unnamed: 10,Unnamed: 11,Unnamed: 12,Unnamed: 13,Unnamed: 14,Unnamed: 15,Unnamed: 16,Unnamed: 17,Unnamed: 18,Unnamed: 19,Unnamed: 20,Unnamed: 21,Unnamed: 22,Unnamed: 23,Unnamed: 24,Unnamed: 25,Unnamed: 26,Unnamed: 27,Unnamed: 28,Unnamed: 29,Unnamed: 30,Unnamed: 31,Unnamed: 32,Unnamed: 33,Unnamed: 34,Unnamed: 35,Unnamed: 36,Unnamed: 37,Unnamed: 38,Unnamed: 39,Unnamed: 40,Unnamed: 41,Unnamed: 42,Unnamed: 43,Unnamed: 44,Unnamed: 45,Unnamed: 46,Unnamed: 47,Unnamed: 48,Unnamed: 49,Unnamed: 50,Unnamed: 51,Unnamed: 52,Unnamed: 53,Unnamed: 54,Unnamed: 55,Unnamed: 56,Unnamed: 57,Unnamed: 58,Unnamed: 59,Unnamed: 60,Unnamed: 61,Unnamed: 62,Unnamed: 63,Unnamed: 64,Unnamed: 65,Unnamed: 66,Unnamed: 67,Unnamed: 68,Unnamed: 69,Unnamed: 70,Unnamed: 71,Unnamed: 72,Unnamed: 73,Unnamed: 74,Unnamed: 75,Unnamed: 76,Unnamed: 77,Unnamed: 78,Unnamed: 79,Unnamed: 80,Unnamed: 81,Unnamed: 82,Unnamed: 83,Unnamed: 84,Unnamed: 85,Unnamed: 86,Unnamed: 87,Unnamed: 88,Unnamed: 89,Unnamed: 90,Unnamed: 91,Unnamed: 92,Unnamed: 93,Unnamed: 94,Unnamed: 95,Unnamed: 96,Unnamed: 97,Unnamed: 98,Unnamed: 99,Unnamed: 100,Unnamed: 101,Unnamed: 102,Unnamed: 103,Unnamed: 104,Unnamed: 105,Unnamed: 106,Unnamed: 107,Unnamed: 108,Unnamed: 109,Unnamed: 110,Unnamed: 111,Unnamed: 112,Unnamed: 113,Unnamed: 114,Unnamed: 115,Unnamed: 116,Unnamed: 117,Unnamed: 118,Unnamed: 119,Unnamed: 120,Unnamed: 121,Unnamed: 122,Unnamed: 123,Unnamed: 124,Unnamed: 125,Unnamed: 126,Unnamed: 127,Unnamed: 128,Unnamed: 129,Unnamed: 130,Unnamed: 131,Unnamed: 132,Unnamed: 133,Unnamed: 134,Unnamed: 135,Unnamed: 136,Unnamed: 137,Unnamed: 138,Unnamed: 139,Unnamed: 140,Unnamed: 141,Unnamed: 142,Unnamed: 143,Unnamed: 144,Unnamed: 145,Unnamed: 146,Unnamed: 147,Unnamed: 148,Unnamed: 149,Unnamed: 150,Unnamed: 151,Unnamed: 152,Unnamed: 153,Unnamed: 154,Unnamed: 155,Unnamed: 156,Unnamed: 157,Unnamed: 158,Unnamed: 159,Unnamed: 160,Unnamed: 161,Unnamed: 162,Unnamed: 163,Unnamed: 164,Unnamed: 165,Unnamed: 166,Unnamed: 167,Unnamed: 168,Unnamed: 169,Unnamed: 170,Unnamed: 171,Unnamed: 172,Unnamed: 173,Unnamed: 174,Unnamed: 175,Unnamed: 176,Unnamed: 177,Unnamed: 178,Unnamed: 179,Unnamed: 180,Unnamed: 181,Unnamed: 182,Unnamed: 183,Unnamed: 184,Unnamed: 185,Unnamed: 186,Unnamed: 187,Unnamed: 188,Unnamed: 189,Unnamed: 190,Unnamed: 191,Unnamed: 192,Unnamed: 193,Unnamed: 194,Unnamed: 195,Unnamed: 196,Unnamed: 197,Unnamed: 198,Unnamed: 199,Unnamed: 200,Unnamed: 201,Unnamed: 202,Unnamed: 203,Unnamed: 204,Unnamed: 205,Unnamed: 206,Unnamed: 207,Unnamed: 208,Unnamed: 209,Unnamed: 210,Unnamed: 211,Unnamed: 212,Unnamed: 213,Unnamed: 214,Unnamed: 215,Unnamed: 216,Unnamed: 217,Unnamed: 218,Unnamed: 219,Unnamed: 220,Unnamed: 221,Unnamed: 222,Unnamed: 223,Unnamed: 224,Unnamed: 225,Unnamed: 226,Unnamed: 227,Unnamed: 228,Unnamed: 229,Unnamed: 230,Unnamed: 231,Unnamed: 232,Unnamed: 233,Unnamed: 234,Unnamed: 235,Unnamed: 236,Unnamed: 237,Unnamed: 238,Unnamed: 239,Unnamed: 240,Unnamed: 241,Unnamed: 242,Unnamed: 243,Unnamed: 244,Unnamed: 245,Unnamed: 246,Unnamed: 247,Unnamed: 248,Unnamed: 249,Unnamed: 250,Unnamed: 251,Unnamed: 252,Unnamed: 253,Unnamed: 254,Unnamed: 255,Unnamed: 256,Unnamed: 257,Unnamed: 258,Unnamed: 259,Unnamed: 260,Unnamed: 261,Unnamed: 262,Unnamed: 263,Unnamed: 264,Unnamed: 265,Unnamed: 266,Unnamed: 267,Unnamed: 268,Unnamed: 269,Unnamed: 270,Unnamed: 271,Unnamed: 272,Unnamed: 273,Unnamed: 274,Unnamed: 275,Unnamed: 276,Unnamed: 277,Unnamed: 278,Unnamed: 279,Unnamed: 280,Unnamed: 281,Unnamed: 282,Unnamed: 283,Unnamed: 284,Unnamed: 285,Unnamed: 286,Unnamed: 287,Unnamed: 288,Unnamed: 289,Unnamed: 290,Unnamed: 291,Unnamed: 292,Unnamed: 293,Unnamed: 294,Unnamed: 295,Unnamed: 296,Unnamed: 297,Unnamed: 298,Unnamed: 299,Unnamed: 300,Unnamed: 301,Unnamed: 302,Unnamed: 303,Unnamed: 304,Unnamed: 305,Unnamed: 306,Unnamed: 307,Unnamed: 308,Unnamed: 309,Unnamed: 310,Unnamed: 311,Unnamed: 312,Unnamed: 313,Unnamed: 314,Unnamed: 315,Unnamed: 316,Unnamed: 317,Unnamed: 318,Unnamed: 319,Unnamed: 320,Unnamed: 321,Unnamed: 322,Unnamed: 323,Unnamed: 324,Unnamed: 325,Unnamed: 326,Unnamed: 327,Unnamed: 328,Unnamed: 329,Unnamed: 330,Unnamed: 331,Unnamed: 332,Unnamed: 333,Unnamed: 334,Unnamed: 335,Unnamed: 336,Unnamed: 337,Unnamed: 338,Unnamed: 339,Unnamed: 340,Unnamed: 341,Unnamed: 342,Unnamed: 343,Unnamed: 344,Unnamed: 345,Unnamed: 346,Unnamed: 347,Unnamed: 348,Unnamed: 349,Unnamed: 350,Unnamed: 351,Unnamed: 352,Unnamed: 353,Unnamed: 354,Unnamed: 355,Unnamed: 356,Unnamed: 357,Unnamed: 358,Unnamed: 359,Unnamed: 360,Unnamed: 361,Unnamed: 362,Unnamed: 363,Unnamed: 364,Unnamed: 365,Unnamed: 366,Unnamed: 367,Unnamed: 368,Unnamed: 369,Unnamed: 370,Unnamed: 371,Unnamed: 372,Unnamed: 373,Unnamed: 374,Unnamed: 375,Unnamed: 376,Unnamed: 377,Unnamed: 378,Unnamed: 379,Unnamed: 380,Unnamed: 381,Unnamed: 382,Unnamed: 383,Unnamed: 384,Unnamed: 385,Unnamed: 386,Unnamed: 387,Unnamed: 388,Unnamed: 389,Unnamed: 390,Unnamed: 391,Unnamed: 392,Unnamed: 393,Unnamed: 394,Unnamed: 395,Unnamed: 396,Unnamed: 397,Unnamed: 398,Unnamed: 399,Unnamed: 400,Unnamed: 401,Unnamed: 402,Unnamed: 403,Unnamed: 404,Unnamed: 405,Unnamed: 406,Unnamed: 407
9EA7A7F9-D80C-4B50-8DE8-E2535FCF0174,660,Gibraltar Detains Oil Supertanker Bound for Syria:   [Foreign Desk ],7/5/19,"LONDON -- The British marines and the port authorities in Gibraltar on Thursday detained a supertanker that was carrying crude oil from Iran to Syria, a violation of European Union sanctions against Syria. The seizure of the ship threatened to raise tensions between Iran and the West.Spain said the vessel had been detained at the request of the United States, and Iran summoned the British ambassador over what a Foreign Ministry spokesman called an ""illegal"" seizure.The Iranian Foreign Ministry spokesman, Seyed Abbas Mousavi, confirmed on Thursday that the detained ship, the Grace 1, was carrying crude oil from Iran, according to Iran's official Islamic Republic News Agency.Although President Trump has imposed sanctions to choke off Iran's exports of oil and petrochemical products, the British and Gibraltar authorities cited not those sanctions but the European Union ones against sanctions on Syria as the reason for detaining the tanker.""We have reason to believe that the Grace 1 was carrying its shipment of crude oil to the Banyas Refinery in Syria,"" Fabian Picardo, the chief minister of Gibraltar, said in a statement. ""That refinery is the property of an entity that is subject to European Union sanctions against Syria.""Spain's acting foreign minister, Josep Borrell, told Spanish news media that the oil tanker had been seized following ""a request from the United States to the United Kingdom."" He said that Spain had been kept informed about the seizure, but offered no details to support his assertion about an American request.Although it is not illegal under international law to buy or ship Iranian oil or related products, foreign companies that do so risk punishment by the United States. Iran has been largely cut off from European markets by the American sanctions, which were imposed by the Trump administration after it withdrew the United States from the nuclear accord.The European parties to the nuclear accord, including Britain, have tried to preserve the fraying deal, which had promised economic relief in exchange for limits to Iran's nuclear program. But Tehran exceeded a critical limit of the accord on Monday, and threatened to breach another as early as Sunday, after weeks of escalating tensions with the United States and months of increasingly dire economic conditions in Iran.Some of the world's shipping fleets have defied the sanctions to continue doing business with Iran. Companies that monitor international shipping say that the Grace 1 turned off its electronic tracking devices as it sailed into Iranian waters, then turned them on again after leaving -- a tactic often used to evade the sanctions, though ships can still be followed through satellite photography.[Read about other ships vanishing in plain sight to evade sanctions on Iran.]The British Foreign Office had no immediate response on Thursday afternoon. On Twitter, Foreign Secretary Jeremy Hunt praised Gibraltar and the British marines ""for this bold move to enforce Syria sanctions."" He said they had denied ""valuable resources"" to the Syrian government.The State Department and the United States National Security Council also did not immediately respond to a request for comment.Mr. Mousavi, the Iranian Foreign Ministry spokesman, said in a post on Twitter that Britain's ambassador to Iran, Rob Macaire, had been summoned to the Iranian Embassy over the seizure. ""We told the ambassador that their action is very strange because these sanctions are not imposed by the Security Council and Iran rejects them,"" Mr. Mousavi said, according to the Islamic Republic News Agency.Mr. Mousavi said that Britain's seizure signaled ""a kind of cross-border sanctions enforcement that the European Union always opposed.""Samir Madani, a founder of TankerTrackers.com, which follows maritime traffic using satellite data, said the ship was anchored near the Iranian oil terminal at Kharg Island in the Persian Gulf in mid-April. Later, he said, it sat deep in the water, indicating that it was carrying oil from Iran.The tanker, which exceeds the size limits for the Suez Canal, sailed around Africa to reach the Mediterranean, ending up in Gibraltar for unexplained reasons.""For some odd reason they decided to go to Gibraltar,"" Mr. Madani said.Various shipping websites list the tanker as a 300,000-ton vessel more than 1,000 feet long, built in the 1990s and flying the flag of Panama.The seizure also threatened to aggravate a dispute between Britain and Spain over Gibraltar, a British territory that Spain contests.Mr. Borrell, who is set to take over as the European Union's foreign policy chief, said that the Spanish government would study whether Britain's actions had violated its territorial water claims. Spain does not recognize Britain's sovereignty over Gibraltar, which dates to a 1713 treaty.""We're looking at which way this affects our sovereignty, in as far as it took place in waters whose sovereignty we understand to belong to Spain,"" Mr. Borrell said, according to the Europa Press news agency and other news reports.",1.0,0,,,,,,,,,,,,,,,,,,,,,,,,,,,,,,,,,,,,,,,,,,,,,,,,,,,,,,,,,,,,,,,,,,,,,,,,,,,,,,,,,,,,,,,,,,,,,,,,,,,,,,,,,,,,,,,,,,,,,,,,,,,,,,,,,,,,,,,,,,,,,,,,,,,,,,,,,,,,,,,,,,,,,,,,,,,,,,,,,,,,,,,,,,,,,,,,,,,,,,,,,,,,,,,,,,,,,,,,,,,,,,,,,,,,,,,,,,,,,,,,,,,,,,,,,,,,,,,,,,,,,,,,,,,,,,,,,,,,,,,,,,,,,,,,,,,,,,,,,,,,,,,,,,,,,,,,,,,,,,,,,,,,,,,,,,,,,,,,,,,,,,,,,,,,,,,,,,,,,,,,,,,,,,,,,,,,,,,,,,,,,,,,,,,,,,,,,,,,,,,,,
F6CFF9BB-D838-419D-A23C-525F59F2E980,888,"Israel Orders More Strikes, Syria Says:   [Foreign Desk ]",7/2/19,"JERUSALEM -- Israeli warplanes struck several military sites in Syria overnight and killed several fighters and civilians, Syrian state media reported on Monday, in what appeared to be a stepping up of Israel's long-running, partly covert campaign to thwart Iranian military entrenchment in Syria and stop weapon transfers to Lebanon.The warplanes fired missiles from Lebanese airspace, according to SANA, the official Syrian news agency, which reported that a baby was among four civilians who were killed. The airstrikes hit a variety of targets, according to the Syrian Observatory for Human Rights, a British-based monitoring group identified with the Syrian opposition.The targets included the headquarters of the Islamic Revolutionary Guards Corps of Iran in the south of the Syrian capital, Damascus; a scientific research center in the countryside around the city; and positions held by Hezbollah, the Iranian-backed Lebanese group, in the mountains near the border with Lebanon, the Observatory said.The Hezbollah sites that were targeted included ammunition warehouses, resulting in explosions and huge fires, the Observatory reported.Israel has carried out many strikes in Syria. The military and government officials declined to comment, in line with their usual policy of ambiguity, an approach intended to avoid forcing the government of Bashar al-Assad or his allies into retaliating.The attack came amid escalating tensions in the region between Iran and the United States over sanctions and the downing of an American reconnaissance drone, and just hours before the International Atomic Energy Agency reported that Iran had surpassed a key limitation on how much nuclear fuel it can possess.Last week, Israel hosted an extraordinary meeting of the national security advisers of Israel, Russia and the United States that was planned long before the recent rise in tensions. Iran and Hezbollah, both archenemies of Israel, together with Russia, have helped Mr. Assad of Syria gain the upper hand in a civil war that began in 2011.Opening that trilateral meeting in Jerusalem, Prime Minister Benjamin Netanyahu of Israel pressed for the withdrawal of all foreign forces from Syria, in particular those of Iran and Iranian proxies near the frontier with Israel. He said Israel had acted ""hundreds of times"" to prevent Iranian military entrenchment in Syria and the transfer of weapons.The Israeli campaign, however surgical, risks miscalculations and unintended consequences. Last year, Syrian forces accidentally shot down a Russian military plane after an Israeli airstrike on Syrian territory, causing a temporary crisis in Israeli-Russian relations.On Monday, the foreign minister of Turkish-held Northern Cyprus, Kudret Ozersay, said that what appeared to be a Russian-made antiaircraft missile fired by Syria at Israeli jets had missed its mark and fallen on the island. There were no reports of casualties.Citing a military source, the Syrian news agency, SANA, said that Syria's air defense had responded to the missiles fired by Israeli warplanes.Another figure close to the Syrian government who was briefed on the strikes and who requested anonymity to discuss secret military information put the total death toll from the attacks higher, saying that at least 16 had been killed, including five Syrian Army personnel, one Iranian and 10 civilians and that 49 others had been wounded. He added that many of the targets had been vacated ahead of time because of the tensions between Iran and the United States and that the civilian casualties had been caused by explosions from munition stores.Though hardly a supporter of Mr. Assad, Israel has professed neutrality in the Syrian civil war, saying that it only acts in the country in the interests of maintaining its own red lines and protecting its own interests. Israel has said it would like to see stability restored there.Speaking on Monday at an annual conference on national security, Yossi Cohen, director of the Mossad, Israel's intelligence service, said that the country had ""no interest in a conflict with Syria, but we cannot agree to Syria serving as an arena in which Iranian forces or forces operated by it become entrenched against us.""Without specifically addressing the overnight activity, Mr. Cohen added that Israel would not allow Syria to become a logistical base for the transfer of weapons to Hezbollah and Lebanon.""Israel has operated in the past four years, overtly and covertly -- only a small part of that has been reported -- to prevent and destroy the entrenchment of Iranian forces in Syria and the infrastructure for manufacturing precision weapons,"" he said. ""Thanks to that resolute action, I believe the Iranians will ultimately reach the conclusion that it's not worth their while.""He said that Iran and Hezbollah were now seeking to move some of their bases to northern Syria, ""a place where they believe, mistakenly, that we will have trouble reaching.""",1.0,0,,,,,,,,,,,,,,,,,,,,,,,,,,,,,,,,,,,,,,,,,,,,,,,,,,,,,,,,,,,,,,,,,,,,,,,,,,,,,,,,,,,,,,,,,,,,,,,,,,,,,,,,,,,,,,,,,,,,,,,,,,,,,,,,,,,,,,,,,,,,,,,,,,,,,,,,,,,,,,,,,,,,,,,,,,,,,,,,,,,,,,,,,,,,,,,,,,,,,,,,,,,,,,,,,,,,,,,,,,,,,,,,,,,,,,,,,,,,,,,,,,,,,,,,,,,,,,,,,,,,,,,,,,,,,,,,,,,,,,,,,,,,,,,,,,,,,,,,,,,,,,,,,,,,,,,,,,,,,,,,,,,,,,,,,,,,,,,,,,,,,,,,,,,,,,,,,,,,,,,,,,,,,,,,,,,,,,,,,,,,,,,,,,,,,,,,,,,,,,,,,
AE8419FD-C42F-4E70-B7AE-55C5C5B22916,1760,North Korea Says It Tested New Weapon:   [Foreign Desk ],4/18/19,"WASHINGTON -- North Korea said on Thursday that it test-fired a new type of ""tactical guided weapon,"" in what appeared to be a warning from Kim Jong-un to President Trump that unless once-promising negotiations with Washington resume, the two countries could again be on a collision course.The North's official Korean Central News Agency did not specify what type of weapon was involved in the test. But there was no evidence the test involved a nuclear detonation or an intercontinental ballistic missile.The North has observed a voluntary moratorium of those tests since November 2017, and President Trump has repeatedly said that the North's self-imposed suspension of nuclear and long-range missile tests was one of his administration's biggest achievements, crediting himself with averting war by first threatening the North with ""fire and fury"" and then holding two face-to-face meetings with Mr. Kim.But at the latest of those meetings, in Hanoi in February, the two leaders failed to reach an agreement, after Mr. Trump rejected, at the insistence of his top advisers, Mr. Kim's proposal to lift the harshest sanctions on the North in return for suspending operations at North Korea's largest nuclear facility. Since then, there has been virtually no communication, much less negotiation, between the two countries.Now Mr. Kim appears to be carefully calibrating his expressions of displeasure.Experts said it was likely that the test announced on Thursday morning in Pyongyang was a demonstration of a conventional weapons system, perhaps artillery or antiaircraft. If so, that would amount to signal-sending by Mr. Kim, who North Korea media said witnessed the test.His presence sent an unmistakable message: That the North would continue to amass new arms while the standoff with Washington continued. Mr. Kim hailed the event as having ""very weighty significance.""In recent days the North Korean leader has said he would give the United States until the end of the year to come up with concrete proposals that would lift sanctions on the North -- an implicit warning that, after that deadline, it might resume the nuclear and intercontinental missile testing that had appeared, in the summer of 2017, to be leading to conflict.But the announcement of Thursday's test suggested that Mr. Kim was willing to consider gradually raising the stakes sooner, and making Mr. Trump fear that his signature foreign policy initiative could collapse before the 2020 elections.Mr. Kim has also been under pressure at home, where many expected him to return from Hanoi celebrating a lifting of the sanctions that have weighed heavily on the North Korean economy.The breakdown of the Hanoi summit was considered a huge embarrassment for Mr. Kim. He took a 65-hour-long train ride to meet Mr. Trump in Hanoi and had to return home without badly needed relief from sanctions. Following the breakdown, satellite imagery showed new activities at some of the North's long-range rocket test and missile development sites.Shin Beom-chul, a North Korea expert at the Asan Institute for Policy Studies in Seoul, said that with this test, Mr. Kim was exhorting his people to prepare for a military standoff with the United States while at the same time putting pressure on Washington.""This time he tried a conventional-weapon test, but he is clearly signaling that if the Americans don't offer a compromise by the end of the year, he will switch to more provocative strategic-weapons tests beginning next year,"" Mr. Shin said.But the test also revealed Mr. Kim's growing desperation, said Woo Jung-yeop, a North Korea expert at the Sejong Institute in South Korea.""Kim Jong-un could not dare a big provocation, but he had to try something to show that North Korea remains a threat and to draw a reluctant United States back to the negotiating table,"" said Mr. Woo.The White House had no immediate comment on the test.Several days ago, appearing with President Moon Jae-in of South Korea, Mr. Trump for the first time suggested he might be willing to entertain a ""step-by-step"" deal to denuclearization -- contradicting his own senior aides, who had been insisting in public comments and private briefings with reporters that only a full dismantlement of the North's nuclear weapons, missiles and facilities would result in the lifting of sanctions.At the meeting in Hanoi, the second between the two leaders who first met in Singapore in June 2018, Mr. Trump had proposed exactly that grand bargain: North Korea would get rid of its entire nuclear weapons arsenal, as well as the material and facilities needed to build and test the weapons, in exchange for an end to the American-led sanctions.Mr. Kim put forth a much more modest bargain in Hanoi. The North would dismantle the Yongbyon nuclear complex, an aging facility at the heart of its nuclear program, for an end to the sanctions most damaging to its economy, those enacted since 2016.Talks quickly broke down, and the summit collapsed, with both sides pointing fingers.In a speech earlier this year, Mr. Kim warned that his country might take a ""new way"" of protecting its interest if the United States insisted on maintaining sanctions.During Thursday's test of the weapon, which was conducted by the North's Academy of Defense Science, Mr. Kim said its development ""serves as an event of very weighty significance in increasing the combat power of the People's Army,"" the North Korean news agency said.The test was the first since last November when the country said Mr. Kim had attended the test of an unidentified ""newly developed ultramodern tactical weapon.""After that test, the South Korean news media, quoting government sources, said that North Korea appeared to have tested multiple-rocket launchers, not missiles. Besides the North's nuclear weapons and missiles, which are probably capable of reaching the continental United States, such rockets are considered one of the greatest military threats to South Korea, because the North deploys them near the countries' border to target the South's capital, Seoul, a city of 10 million people.The Defense Ministry of South Korea did not immediately comment on the North's latest weapon test. But officials there said the test of a ""tactical weapon"" indicated that Mr. Kim was being careful not to step over the line by conducting nuclear and long-range ballistic missile tests.While Mr. Kim is clearly impatient with Washington, he has avoided direct criticism of Mr. Trump. Instead, he has portrayed other members of the administration as hawks, or warmongers, making clear the only way to resolve the issues is in personality-driven diplomacy with Mr. Trump.But some analysts in South Korea had warned that the North might resort to low-level provocations, like rocket or even short-range ballistic missile tests, to increase its bargaining power should Mr. Trump not return to the negotiating table with a compromise.North Korea has a history of using the prospect of rising tensions on the Korean Peninsula as leverage when negotiations with Washington do not go in its favor.Mr. Trump, who has said he and Mr. Kim ""fell in love,"" has said he would be ""very disappointed"" if the North resumes weapons tests. But he also said he was in no hurry to meet Mr. Kim again. United States officials hope that sanctions will eventually force North Korea back to the negotiating table with a more palatable offer to denuclearize.This is a more complete version of the story than the one that appeared in print.Photograph Kim Jong-un, North Korea's leader. His country has observed a voluntary moratorium on missile tests since November 2017. (PHOTOGRAPH BY KOREAN CENTRAL NEWS AGENCY, VIA REUTERS) (A12)",1.0,0,,,,,,,,,,,,,,,,,,,,,,,,,,,,,,,,,,,,,,,,,,,,,,,,,,,,,,,,,,,,,,,,,,,,,,,,,,,,,,,,,,,,,,,,,,,,,,,,,,,,,,,,,,,,,,,,,,,,,,,,,,,,,,,,,,,,,,,,,,,,,,,,,,,,,,,,,,,,,,,,,,,,,,,,,,,,,,,,,,,,,,,,,,,,,,,,,,,,,,,,,,,,,,,,,,,,,,,,,,,,,,,,,,,,,,,,,,,,,,,,,,,,,,,,,,,,,,,,,,,,,,,,,,,,,,,,,,,,,,,,,,,,,,,,,,,,,,,,,,,,,,,,,,,,,,,,,,,,,,,,,,,,,,,,,,,,,,,,,,,,,,,,,,,,,,,,,,,,,,,,,,,,,,,,,,,,,,,,,,,,,,,,,,,,,,,,,,,,,,,,,
